[
  {
    "id": "work:gita",
    "type": "Work",
    "title": { "sa": "भगवद्गीता", "en": "Bhagavad Gītā", "pt": "Bhagavad Gita" },
    "tradition": "hindu",
    "cr_grammar": "gita:chapter.verse",
    "cr_pattern": "^gita:\\d{1,2}\\.\\d{1,3}$",
    "unit_count": 700,
    "structure": ["chapter", "verse"],
    "source_languages": ["sa"],
    "policy": "policy:gita.v1",
    "notes": "Build first. Smallest complete corpus, sharpest contestation (Śaṅkara / Rāmānuja / Madhva / Tilak / Gandhi), cleanest licensing, and Devanāgarī combining marks already exercise grapheme alignment."
  },
  {
    "id": "work:analects",
    "type": "Work",
    "title": { "zh": "論語", "en": "The Analects", "pt": "Analectos" },
    "tradition": "confucian",
    "cr_grammar": "analects:book.chapter",
    "cr_pattern": "^analects:\\d{1,2}\\.\\d{1,3}$",
    "unit_count": 512,
    "structure": ["book", "chapter"],
    "source_languages": ["lzh"],
    "policy": "policy:analects.v1",
    "notes": "Zhu Xi's Jizhu was the imperial examination curriculum from 1313 to 1905 across China, Korea, Japan and Vietnam — one interpretive layer selecting a civilisation's governing class for six centuries."
  },
  {
    "id": "work:quran",
    "type": "Work",
    "title": { "ar": "القرآن", "en": "Qur'ān", "pt": "Alcorão" },
    "tradition": "islamic",
    "cr_grammar": "quran:sura:ayah",
    "cr_pattern": "^quran:\\d{1,3}:\\d{1,3}$",
    "unit_count": 6236,
    "structure": ["sura", "ayah"],
    "source_languages": ["ar"],
    "policy": "policy:quran.v1",
    "notes": "The hardest case and therefore the most useful to design against: RTL, an immutable source text, and a tradition where translation is categorically secondary."
  },
  {
    "id": "work:bible",
    "type": "Work",
    "title": { "he": "תנ\"ך", "grc": "Βιβλία", "en": "Bible", "pt": "Bíblia" },
    "tradition": "christian",
    "cr_grammar": "bible:BOOK.chapter.verse (USFM book codes)",
    "cr_pattern": "^bible:[A-Z0-9]{3}\\.\\d{1,3}\\.\\d{1,3}$",
    "unit_count": 31102,
    "structure": ["book", "chapter", "verse"],
    "source_languages": ["he", "arc", "grc"],
    "policy": "policy:bible.v1",
    "notes": "Chapters from Langton (c. 1227), verses from Estienne (1551) — stable across every translation since, which is exactly the property the Canonical Reference needs."
  }
]
